<?xml version="1.0" encoding="utf-8"?>
<Spec xmlns="Parser/Spec" xmlns:xsi="http://www.w3.org/2001/XMLSchema-instance" xsi:schemaLocation="Parser\Spec ..\Schemas\Spec.xsd">
 
    <Name>wad2</Name>
    <TextFile>false</TextFile>
    <Instructions>
      <Label name="Start"/>
      <MakeCursor cursor_var="current_pos" list_var="bytes" position="0"/>
      <ReadData output_var="file_id" type="text" length="4" cursor_var="current_pos"/>
      <ReadData output_var="numlumps" type="int" cursor_var="current_pos"/>
      <ReadData output_var="diroffset" type="int" cursor_var="current_pos"/>
      <SetCursorPos cursor_var="current_pos" position_var="diroffset"/>
      <Initialize initial_var="directory" type="Collection" value_type="WadLump"/>
      <ForCount length_var="numlumps" cursor_var="index">
        <ReadData output_var="lump_pos" content_var="bytes" type="int" cursor_var="current_pos"/>
        <ReadData output_var="lump_dsize" content_var="bytes" type="int" cursor_var="current_pos"/>
        <ReadData output_var="lump_size" content_var="bytes" type="int" cursor_var="current_pos"/>
        <ReadData output_var="lump_type" content_var="bytes" type="byte" cursor_var="current_pos"/>
        <ReadData output_var="lump_cmprs" content_var="bytes" type="byte" cursor_var="current_pos"/>
        <ReadData output_var="lump_dummy" content_var="bytes" type="short" cursor_var="current_pos"/>
        <ReadData output_var="lump_name" content_var="bytes" type="text" length="16" cursor_var="current_pos"/>
        <ReadData output_var="lump_data" content_var="bytes" type="binary" length_var="lump_size" position_var="lump_pos"/>
        <AddItem name="directory" type="WadLump">lump_pos lump_size lump_name lump_data</AddItem>
      </ForCount>
      <Terminate success="true"/>
    </Instructions>

    <FileInferences initial="and">
      <Extension>wad</Extension>
      <Header>WAD2</Header>
    </FileInferences>
  </Spec>